{
  "schemaVersion": "2026-05-30.workflow-plugin.approval.v1",
  "approvalId": "workflow_plugin_approval_001",
  "draftId": "workflow_draft_lesson_archive_review",
  "sandboxRunId": "sandbox_run_lesson_archive_review_001",
  "reviewerPrincipalId": "principal_teacher_admin",
  "decision": "APPROVED",
  "performanceReviewed": true,
  "effectReviewed": true,
  "registrySaveDecision": "ALLOW_SAVE",
  "reviewedAt": "2026-05-30T13:05:00Z",
  "comments": "Sandbox evidence is acceptable for registry save."
}
